<?xml version="1.0" encoding="UTF-8"?>
<!--
  ~     Percussion CMS
  ~     Copyright (C) Percussion Software, Inc.  1999-2020
  ~
  ~     This program is free software: you can redistribute it and/or modify
  ~     it under the terms of the GNU General Public License as published by
  ~     the Free Software Foundation, either version 3 of the License, or
  ~     (at your option) any later version.
  ~
  ~     This program is distributed in the hope that it will be useful,
  ~     but WITHOUT ANY WARRANTY; without even the implied warranty of
  ~     MERCHANTABILITY or FITNESS FOR A PARTICULAR PURPOSE.  See the
  ~     GNU General Public License for more details.
  ~
  ~      Mailing Address:
  ~
  ~      Percussion Software, Inc.
  ~      PO Box 767
  ~      Burlington, MA 01803, USA
  ~      +01-781-438-9900
  ~      support@percussion.com
  ~      https://www.percusssion.com
  ~
  ~     You should have received a copy of the GNU General Public License
  ~     along with this program.  If not, see <https://www.gnu.org/licenses/>.
  -->

<!-- edited with XMLSPY v5 rel. 4 U (http://www.xmlspy.com) by Ben Chen (Percussion Software) -->
<!--W3C Schema generated by XMLSPY v5 rel. 2 U (http://www.xmlspy.com)-->
<xs:schema xmlns:xs="http://www.w3.org/2001/XMLSchema" elementFormDefault="qualified">
	<xs:element name="SolutionConfig">
		<xs:annotation>
			<xs:documentation>A set of related configurations.</xs:documentation>
		</xs:annotation>
		<xs:complexType>
			<xs:sequence>
				<xs:element ref="description" minOccurs="0"/>
				<xs:choice maxOccurs="unbounded">
					<xs:element ref="property" minOccurs="0" maxOccurs="unbounded"/>
					<xs:element ref="propertySet" minOccurs="0" maxOccurs="unbounded"/>
				</xs:choice>
			</xs:sequence>
			<xs:attribute name="name" type="xs:string" use="required">
				<xs:annotation>
					<xs:documentation>The name of this configuration group. e.g. RSS, Segmentation.</xs:documentation>
				</xs:annotation>
			</xs:attribute>
		</xs:complexType>
	</xs:element>
	<xs:element name="SolutionConfigurations">
		<xs:annotation>
			<xs:documentation>All the configurations for a set of solutions. </xs:documentation>
		</xs:annotation>
		<xs:complexType>
			<xs:sequence>
				<xs:element ref="SolutionConfig" maxOccurs="unbounded"/>
			</xs:sequence>
			<xs:attribute name="publisherPrefix" type="xs:string" use="required">
				<xs:annotation>
					<xs:documentation>An arbitrary string used as a prefix for all names in this configuration file. Generally, it should be a name that is unique to the publisher, such as com.percussion. The same prefix should generally be used for all package configurations.</xs:documentation>
				</xs:annotation>
			</xs:attribute>
			<xs:attribute name="publisherName" type="xs:string" use="required">
				<xs:annotation>
					<xs:documentation>Who created this package.</xs:documentation>
				</xs:annotation>
			</xs:attribute>
		</xs:complexType>
	</xs:element>
	<xs:element name="description" type="xs:string">
		<xs:annotation>
			<xs:documentation>Information describing an aspect of the configuration and how to set it, including allowable values.</xs:documentation>
		</xs:annotation>
	</xs:element>
	<xs:element name="entry">
		<xs:annotation>
			<xs:documentation>One element in a list.</xs:documentation>
		</xs:annotation>
		<xs:complexType>
			<xs:simpleContent>
				<xs:extension base="xs:string">
					<xs:attribute name="pvalue" type="xs:string" use="optional"/>
				</xs:extension>
			</xs:simpleContent>
		</xs:complexType>
	</xs:element>
	<xs:element name="pair">
		<xs:annotation>
			<xs:documentation>Two pieces of data that belong together.</xs:documentation>
		</xs:annotation>
		<xs:complexType>
			<xs:all>
				<xs:element name="pvalue1" type="xs:string" minOccurs="0">
					<xs:annotation>
						<xs:documentation>One part of a pair of data values. For simple content, the 'value1' attribute of the parent may be used instead.</xs:documentation>
					</xs:annotation>
				</xs:element>
				<xs:element name="pvalue2" type="xs:string" minOccurs="0">
					<xs:annotation>
						<xs:documentation>The other part of a pair of data values. For simple content, the 'value2' attribute of the parent may be used instead.</xs:documentation>
					</xs:annotation>
				</xs:element>
			</xs:all>
			<xs:attribute name="value1" type="xs:string" use="optional">
				<xs:annotation>
					<xs:documentation>This is a convenience attribute. If a left element child is not found, then this attribute is used. </xs:documentation>
				</xs:annotation>
			</xs:attribute>
			<xs:attribute name="value2" type="xs:string" use="optional">
				<xs:annotation>
					<xs:documentation>This is a convenience attribute. If a right element child is not found, then this attribute is used. </xs:documentation>
				</xs:annotation>
			</xs:attribute>
		</xs:complexType>
	</xs:element>
	<xs:element name="property">
		<xs:annotation>
			<xs:documentation>A named piece of data that controls how the system behaves in some way.</xs:documentation>
		</xs:annotation>
		<xs:complexType>
			<xs:sequence>
				<xs:element ref="description" minOccurs="0"/>
				<xs:choice>
					<xs:element ref="pvalue" minOccurs="0"/>
					<xs:element name="pvalues" minOccurs="0">
						<xs:complexType>
							<xs:choice>
								<xs:element ref="pvalue" minOccurs="0" maxOccurs="unbounded"/>
								<xs:element ref="pair" minOccurs="0" maxOccurs="unbounded"/>
							</xs:choice>
						</xs:complexType>
					</xs:element>
					<xs:element ref="propertySet" minOccurs="0" maxOccurs="unbounded"/>
				</xs:choice>
			</xs:sequence>
			<xs:attribute name="name" type="xs:string" use="required">
				<xs:annotation>
					<xs:documentation>The name of this property. Must be unique within the enclosing parent. Case-insensitive.</xs:documentation>
				</xs:annotation>
			</xs:attribute>
			<xs:attribute name="value" type="xs:string" use="optional">
				<xs:annotation>
					<xs:documentation>The content of the property. This is a convenience. The content may instead be placed in a child Value element. If this element has any child element, this attribute is ignored.</xs:documentation>
				</xs:annotation>
			</xs:attribute>
			<xs:attribute name="action" use="optional" default="replace">
				<xs:annotation>
					<xs:documentation>This attribute only applies if the property is a collection type. Defines how these values are resolved with the collection in the design object. Most objects only support replace at this time. See the doc for each property to determine which actions are supported.</xs:documentation>
				</xs:annotation>
				<xs:simpleType>
					<xs:restriction base="xs:NMTOKEN">
						<xs:enumeration value="merge">
							<xs:annotation>
								<xs:documentation>Look at the action in each entry here and perform that action against the collection/map in the target design object.
</xs:documentation>
							</xs:annotation>
						</xs:enumeration>
						<xs:enumeration value="replace">
							<xs:annotation>
								<xs:documentation>Remove all entries in the design object's collection and use those found here instead. Document order is maintained if the target is a list.</xs:documentation>
							</xs:annotation>
						</xs:enumeration>
					</xs:restriction>
				</xs:simpleType>
			</xs:attribute>
		</xs:complexType>
	</xs:element>
	<xs:element name="propertySet">
		<xs:annotation>
			<xs:documentation>A container of properties. Generally, they are related in some way.</xs:documentation>
		</xs:annotation>
		<xs:complexType>
			<xs:sequence>
				<xs:element ref="description" minOccurs="0"/>
				<xs:choice maxOccurs="unbounded">
					<xs:element ref="propertySet" minOccurs="0" maxOccurs="unbounded"/>
					<xs:element ref="property" minOccurs="0" maxOccurs="unbounded"/>
				</xs:choice>
			</xs:sequence>
			<xs:attribute name="action" use="optional" default="update">
				<xs:annotation>
					<xs:documentation>Only used if this element is a member of a collection. Indicates how to process this particular entry. Only certain collections support this capability. See the doc to determine what is supported. If not supported, it is ignored.</xs:documentation>
				</xs:annotation>
				<xs:simpleType>
					<xs:restriction base="xs:NMTOKEN">
						<xs:enumeration value="remove">
							<xs:annotation>
								<xs:documentation>Only the key part of this set is used. If an entry in the target collection matches this key, it is removed from the target. Otherwise, this entry is skipped.</xs:documentation>
							</xs:annotation>
						</xs:enumeration>
						<xs:enumeration value="update">
							<xs:annotation>
								<xs:documentation>If an entry in the target collection matches this key, it is updated to match this entry. Otherwise, a new entry is added.</xs:documentation>
							</xs:annotation>
						</xs:enumeration>
					</xs:restriction>
				</xs:simpleType>
			</xs:attribute>
			<xs:attribute name="name" type="xs:string" use="optional">
				<xs:annotation>
					<xs:documentation>If this element needs to be referenced from the configuration definition, then a name should be supplied, otherwise one is not needed, but may be provided if it improves readability. A name is required if this element is a child of SolutionConfig.</xs:documentation>
				</xs:annotation>
			</xs:attribute>
		</xs:complexType>
	</xs:element>
	<xs:element name="pvalue" type="xs:string">
		<xs:annotation>
			<xs:documentation>The content of some property. For single-valued, simple content, the 'value' attribute of the parent may be used instead.</xs:documentation>
		</xs:annotation>
	</xs:element>
</xs:schema>
