<?xml version="1.0" encoding="UTF-8"?>

<!--
  ~     Percussion CMS
  ~     Copyright (C) Percussion Software, Inc.  1999-2020
  ~
  ~     This program is free software: you can redistribute it and/or modify
  ~     it under the terms of the GNU General Public License as published by
  ~     the Free Software Foundation, either version 3 of the License, or
  ~     (at your option) any later version.
  ~
  ~     This program is distributed in the hope that it will be useful,
  ~     but WITHOUT ANY WARRANTY; without even the implied warranty of
  ~     MERCHANTABILITY or FITNESS FOR A PARTICULAR PURPOSE.  See the
  ~     GNU General Public License for more details.
  ~
  ~      Mailing Address:
  ~
  ~      Percussion Software, Inc.
  ~      PO Box 767
  ~      Burlington, MA 01803, USA
  ~      +01-781-438-9900
  ~      support@percussion.com
  ~      https://www.percusssion.com
  ~
  ~     You should have received a copy of the GNU General Public License
  ~     along with this program.  If not, see <https://www.gnu.org/licenses/>.
  -->

<SolutionConfigurations publisherPrefix="com.percussion" publisherName="Percussion"  xmlns:xsi="http://www.w3.org/2001/XMLSchema-instance" xsi:noNamespaceSchemaLocation="localConfig.xsd">
   <SolutionConfig name="RSS">

<!---  ========================================
        Content List        "rffCiFullBinary"      
        =========================================
-->
      <property name="deliveryType" value="filesystem"/>
      <property name="filter" value="public"/>
      <property name="generator" value="Java/global/percussion/system/sys_SearchGenerator"/>
      <propertySet name="generatorParams">
      	<property name="query" value="select rx:sys_contentid, rx:sys_folderid from rx:rfffile,rx:rffimage,rx:percnavimage where jcr:path like '//Sites/CorporateInvestments%'"/>
      </propertySet>
      <property name="expander" value="Java/global/percussion/system/sys_SiteTemplateExpander"/>
      <propertySet name="expanderParams">
      </propertySet>
   </SolutionConfig>
</SolutionConfigurations>
