<?xml version="1.0" encoding="UTF-8"?>
<!--
  ~     Percussion CMS
  ~     Copyright (C) Percussion Software, Inc.  1999-2020
  ~
  ~     This program is free software: you can redistribute it and/or modify
  ~     it under the terms of the GNU General Public License as published by
  ~     the Free Software Foundation, either version 3 of the License, or
  ~     (at your option) any later version.
  ~
  ~     This program is distributed in the hope that it will be useful,
  ~     but WITHOUT ANY WARRANTY; without even the implied warranty of
  ~     MERCHANTABILITY or FITNESS FOR A PARTICULAR PURPOSE.  See the
  ~     GNU General Public License for more details.
  ~
  ~      Mailing Address:
  ~
  ~      Percussion Software, Inc.
  ~      PO Box 767
  ~      Burlington, MA 01803, USA
  ~      +01-781-438-9900
  ~      support@percussion.com
  ~      https://www.percusssion.com
  ~
  ~     You should have received a copy of the GNU General Public License
  ~     along with this program.  If not, see <https://www.gnu.org/licenses/>.
  -->

<SolutionConfigurations publisherPrefix="com.percussion" publisherName=" Percussion"  xmlns:xsi="http://www.w3.org/2001/XMLSchema-instance" xsi:noNamespaceSchemaLocation="localConfig.xsd">
	<SolutionConfig name="PSRelationshipConfigTest">
		<propertySet name="deepCloning">
			<property name="enabled" value="true"/>
			<property name="condition">
				<propertySet>
					<property name="type" value="Conditional"/>
					<property name="rules">
						<propertySet>
							<property name="variable1" value="PSXOriginatingRelationshipProperty/name"/>
							<property name="variable2" value="Translation-Mandatory"/>
							<property name="operator" value="="/>
							<property name="boolean" value="AND"/>
						</propertySet>
						<propertySet>
							<property name="variable1" value="PSXSingleHTMLParameter/sys_communityid"/>
							<property name="variable2" value="1001"/>
							<property name="operator" value="="/>
							<property name="boolean" value="AND"/>
						</propertySet>
					</property>
					<property name="boolean" value="AND"/>
				</propertySet>
			</property>
		</propertySet>
		<propertySet name="shallowCloning">
			<property name="enabled" value="true"/>
			<property name="condition">
				<propertySet>
					<property name="type" value="Conditional"/>
					<property name="rules">
						<propertySet>
							<property name="variable1" value="PSXOriginatingRelationshipProperty/name"/>
							<property name="variable2" value="Translation-Mandatory"/>
							<property name="operator" value="="/>
							<property name="boolean" value="AND"/>
						</propertySet>
						<propertySet>
							<property name="variable1" value="PSXSingleHTMLParameter/sys_communityid"/>
							<property name="variable2" value="1001"/>
							<property name="operator" value="="/>
							<property name="boolean" value="AND"/>
						</propertySet>
					</property>
					<property name="boolean" value="AND"/>
				</propertySet>
				<propertySet>
					<property name="type" value="Extension"/>
					<property name="name" value="Java/global/percussion/generic/sys_OverrideLiteral"/>
					<property name="extensionParams">
						<pvalues>
							<pvalue>PSXSingleHTMLParameter/sys_contentid</pvalue>
							<pvalue>1001</pvalue>
						</pvalues>
					</property>
					<property name="boolean" value="AND"/>
				</propertySet>
			</property>
		</propertySet>
		<property name="fieldOverrides">
			<propertySet>
				<property name="fieldName" value="displaytitle"/>
				<property name="extension" value="Java/global/percussion/generic/sys_OverrideLiteral"/>
				<property name="extensionParams">
					<pvalues>
						<pvalue>PSXContentItemStatus/CONTENTSTATUS.TITLE</pvalue>
						<pvalue>displaytitle</pvalue>
					</pvalues>
				</property>
			</propertySet>
		</property>
		<property name="effects">
			<propertySet>
				<property name="executionContext">
					<pvalues>
						<pvalue>Pre-Construction</pvalue>
						<pvalue>Pre-Destruction</pvalue>
					</pvalues>
				</property>
				<property name="direction" value="Up"/>
                		<property name="extension" value="Java/global/percussion/relationship/effect/sys_PublishMandatory"/>
				<property name="extensionParams">
					<pvalues>
						<pvalue>PSXSingleHTMLParameter/sys_contentid</pvalue>
						<pvalue>1001</pvalue>
					</pvalues>
				</property>
				<property name="condition">
					<propertySet>
						<property name="type" value="Conditional"/>
						<property name="rules">
							<propertySet>
								<property name="variable1" value="PSXSingleHTMLParameter/sys_communityid"/>
								<property name="variable2" value="1001"/>
								<property name="operator" value="="/>
								<property name="boolean" value="AND"/>
							</propertySet>
							<propertySet>
								<property name="variable1" value="PSXSingleHTMLParameter/sys_contentid"/>
								<property name="variable2" value="1001"/>
								<property name="operator" value="="/>
								<property name="boolean" value="AND"/>
							</propertySet>
						</property>
						<property name="boolean" value="AND"/>
					</propertySet>
					<propertySet>
						<property name="type" value="Extension"/>
						<property name="name" value="Java/global/percussion/generic/sys_OverrideLiteral"/>
						<property name="extensionParams">
							<pvalues>
								<pvalue>PSXSingleHTMLParameter/sys_contentid</pvalue>
								<pvalue>1001</pvalue>
							</pvalues>
						</property>
						<property name="boolean" value="AND"/>
					</propertySet>
				</property>
			</propertySet>
		</property>
	</SolutionConfig>
</SolutionConfigurations>
