<?xml version="1.0" encoding="UTF-8"?>

<!--
  ~     Percussion CMS
  ~     Copyright (C) Percussion Software, Inc.  1999-2020
  ~
  ~     This program is free software: you can redistribute it and/or modify
  ~     it under the terms of the GNU General Public License as published by
  ~     the Free Software Foundation, either version 3 of the License, or
  ~     (at your option) any later version.
  ~
  ~     This program is distributed in the hope that it will be useful,
  ~     but WITHOUT ANY WARRANTY; without even the implied warranty of
  ~     MERCHANTABILITY or FITNESS FOR A PARTICULAR PURPOSE.  See the
  ~     GNU General Public License for more details.
  ~
  ~      Mailing Address:
  ~
  ~      Percussion Software, Inc.
  ~      PO Box 767
  ~      Burlington, MA 01803, USA
  ~      +01-781-438-9900
  ~      support@percussion.com
  ~      https://www.percusssion.com
  ~
  ~     You should have received a copy of the GNU General Public License
  ~     along with this program.  If not, see <https://www.gnu.org/licenses/>.
  -->

<SolutionConfigurations publisherPrefix="com.percussion" publisherName="Percussion"  xmlns:xsi="http://www.w3.org/2001/XMLSchema-instance" xsi:noNamespaceSchemaLocation="localConfig.xsd">
   <SolutionConfig name="RSS">
      <!-- Basic Properties -->
      <property name="label" value="P - CI Generic"/>
      <property name="globalTemplate" value="rffGtCorporateInvestmentsCommon"/>
      <property name="globalTemplateUsage" value="Default"/>
      <property name="publishWhen" value="Default"/>
      <property name="bindingSet">
         <pvalues>
            <pair value1="$rxs_navbase" value2="$sys.variables.rxs_navbase"/>
            <pair value1="$rxs_navbase_1" value2="$sys.variables.rxs_navbase_1"/>
            <pair value1="$rxs_navbase_2" value2="$sys.variables.rxs_navbase_2"/>
<!--            
-->            
         </pvalues>
      </property>

		<property name="ci_or_allSites">
			<pvalues>
				<pvalue>Corporate_Investments</pvalue>
			</pvalues>
		</property>		
      
      <property name="visibility">
      		<pvalues>
       		    <pvalue>rffPgCiGeneric</pvalue>
      		</pvalues>
      </property>

   </SolutionConfig>
</SolutionConfigurations>
