<?xml version="1.0" encoding="UTF-8"?>

<!--
  ~     Percussion CMS
  ~     Copyright (C) Percussion Software, Inc.  1999-2020
  ~
  ~     This program is free software: you can redistribute it and/or modify
  ~     it under the terms of the GNU General Public License as published by
  ~     the Free Software Foundation, either version 3 of the License, or
  ~     (at your option) any later version.
  ~
  ~     This program is distributed in the hope that it will be useful,
  ~     but WITHOUT ANY WARRANTY; without even the implied warranty of
  ~     MERCHANTABILITY or FITNESS FOR A PARTICULAR PURPOSE.  See the
  ~     GNU General Public License for more details.
  ~
  ~      Mailing Address:
  ~
  ~      Percussion Software, Inc.
  ~      PO Box 767
  ~      Burlington, MA 01803, USA
  ~      +01-781-438-9900
  ~      support@percussion.com
  ~      https://www.percusssion.com
  ~
  ~     You should have received a copy of the GNU General Public License
  ~     along with this program.  If not, see <https://www.gnu.org/licenses/>.
  -->

<SolutionConfigurations publisherPrefix="com.percussion" publisherName="Percussion"  xmlns:xsi="http://www.w3.org/2001/XMLSchema-instance" xsi:noNamespaceSchemaLocation="localConfig.xsd">
   <SolutionConfig name="RSS">

<!---  ========================================================
        Location Scheme        "Site_Folder_Assembly / CI_Home"      
        =======================================================
-->
	
      <property name="expression">
      	<pvalue>'/index.html'</pvalue>
      </property>

		<property name="generator" value="sys_casDefaultAssemblyLocation"/>
		
		<property name="generatorParams">
			<pvalues>
				<pair value1="root" value2="/home/support"/>
				<pair value1="path" value2="publish"/>
				<pair value1="suffix" value2="html"/>
				<pair value1="extraParam" value2="will be ignored"/>
			</pvalues>
		</property>
		
		<property name="contextWildCard" value="*b*"/>
		
		<property name="publishAndSiteScheme">
			<pvalues>
				<pvalue>Publish</pvalue>
				<pvalue>Site_Folder_Assembly</pvalue>
			</pvalues>
		</property>

		<property name="description" value="CI Home page location 天天"/>

		<property name="description天天" value="CI Home page location 天天"/>
						
   </SolutionConfig>
</SolutionConfigurations>
