<?xml version="1.0" encoding="UTF-8"?>
<!--
  ~     Percussion CMS
  ~     Copyright (C) Percussion Software, Inc.  1999-2020
  ~
  ~     This program is free software: you can redistribute it and/or modify
  ~     it under the terms of the GNU General Public License as published by
  ~     the Free Software Foundation, either version 3 of the License, or
  ~     (at your option) any later version.
  ~
  ~     This program is distributed in the hope that it will be useful,
  ~     but WITHOUT ANY WARRANTY; without even the implied warranty of
  ~     MERCHANTABILITY or FITNESS FOR A PARTICULAR PURPOSE.  See the
  ~     GNU General Public License for more details.
  ~
  ~      Mailing Address:
  ~
  ~      Percussion Software, Inc.
  ~      PO Box 767
  ~      Burlington, MA 01803, USA
  ~      +01-781-438-9900
  ~      support@percussion.com
  ~      https://www.percusssion.com
  ~
  ~     You should have received a copy of the GNU General Public License
  ~     along with this program.  If not, see <https://www.gnu.org/licenses/>.
  -->

<SolutionConfigurations publisherPrefix="com.percussion" publisherName=" Perc5ussion" xmlns:xsi="http://www.w3.org/2001/XMLSchema-instance" xsi:noNamespaceSchemaLocation="localConfig.xsd">
	<SolutionConfig name="PSActionSetterTest">
		<property name="actionLabel" value="Quick Edit"/>
		<property name="actionDescription" value="Transitions the current item into a Quick Edit state, check it out and opens it in edit mode."/>
		<property name="actionUrl" value="../sys_action/transitcheckoutedit.xml"/>
		<property name="dynamicParam" value="Quick Edit"/>
		<property name="hideForAssignmentTypes">
			<pvalues>
				<pvalue>none</pvalue>
				<pvalue>reader</pvalue>
			</pvalues>
		</property>
		<property name="hideForCheckoutStatus">
			<pvalues>
				<pvalue>checked out</pvalue>
			</pvalues>
		</property>
		<property name="hideForContentTypes">
			<pvalues/>
		</property>
		<property name="hideForFolderSecurity">
			<pvalues/>
		</property>
		<property name="hideForLocales">
			<pvalues/>
		</property>
		<property name="hideForObjectTypes">
			<pvalues>
				<pvalue>folder</pvalue>
			</pvalues>
		</property>
		<property name="hideForPublishable">
			<pvalues>
				<pvalue>archive</pvalue>
				<pvalue>ignore</pvalue>
				<pvalue>unpublish</pvalue>
			</pvalues>
		</property>
		<property name="hideForRoles">
			<pvalues/>
		</property>
		<property name="hideForWorkflow">
			<pvalues/>
		</property>
	</SolutionConfig>
</SolutionConfigurations>
