<?xml version="1.0" encoding="UTF-8"?>

<!--
  ~     Percussion CMS
  ~     Copyright (C) Percussion Software, Inc.  1999-2020
  ~
  ~     This program is free software: you can redistribute it and/or modify
  ~     it under the terms of the GNU General Public License as published by
  ~     the Free Software Foundation, either version 3 of the License, or
  ~     (at your option) any later version.
  ~
  ~     This program is distributed in the hope that it will be useful,
  ~     but WITHOUT ANY WARRANTY; without even the implied warranty of
  ~     MERCHANTABILITY or FITNESS FOR A PARTICULAR PURPOSE.  See the
  ~     GNU General Public License for more details.
  ~
  ~      Mailing Address:
  ~
  ~      Percussion Software, Inc.
  ~      PO Box 767
  ~      Burlington, MA 01803, USA
  ~      +01-781-438-9900
  ~      support@percussion.com
  ~      https://www.percusssion.com
  ~
  ~     You should have received a copy of the GNU General Public License
  ~     along with this program.  If not, see <https://www.gnu.org/licenses/>.
  -->

<SolutionConfigurations publisherPrefix="com.percussion" publisherName="Percussion" xmlns:xsi="http://www.w3.org/2001/XMLSchema-instance" xsi:noNamespaceSchemaLocation="localConfig.xsd">
   <SolutionConfig name="RSS">

<!---  ========================================
        Slot Type        "rffEvents"      
        =========================================
-->
      <property name="slotAssociations">
         <pvalues>
            <pair value1="rffEvent" value2="rffSnTitleLink" />
         </pvalues>
      </property>

      <propertySet name="finderParameters">
	      <property name="query"  value="select rx:sys_contentid, rx:sys_contentstartdate  from rx:rffcalendar  where jcr:path like :sitepath order by rx:sys_contentstartdate  asc"/>
	      <property name="type"  value="sql"/>
	      <property name="template"  value="rffSnTitleCalloutLink"/>
	      <property name="max_results" value="4"/>
	      <property name="sys_lang" value=""/>
      </propertySet>

   </SolutionConfig>
</SolutionConfigurations>

