<?xml version="1.0" encoding="UTF-8"?>

<!--
  ~     Percussion CMS
  ~     Copyright (C) Percussion Software, Inc.  1999-2020
  ~
  ~     This program is free software: you can redistribute it and/or modify
  ~     it under the terms of the GNU General Public License as published by
  ~     the Free Software Foundation, either version 3 of the License, or
  ~     (at your option) any later version.
  ~
  ~     This program is distributed in the hope that it will be useful,
  ~     but WITHOUT ANY WARRANTY; without even the implied warranty of
  ~     MERCHANTABILITY or FITNESS FOR A PARTICULAR PURPOSE.  See the
  ~     GNU General Public License for more details.
  ~
  ~      Mailing Address:
  ~
  ~      Percussion Software, Inc.
  ~      PO Box 767
  ~      Burlington, MA 01803, USA
  ~      +01-781-438-9900
  ~      support@percussion.com
  ~      https://www.percusssion.com
  ~
  ~     You should have received a copy of the GNU General Public License
  ~     along with this program.  If not, see <https://www.gnu.org/licenses/>.
  -->

<SolutionConfigurations publisherPrefix="com.percussion" publisherName="Percussion" xmlns:xsi="http://www.w3.org/2001/XMLSchema-instance" xsi:noNamespaceSchemaLocation="localConfig.xsd">
   <SolutionConfig name="RSS">

<!---  ========================================
        Content Type        "rffBrief"      
        =========================================
-->	
	<propertySet name="ct">
  
      <property name="label" value="My-Brief"/>
      <property name="iconValue" value=""/>
<!--      
      <property name="defaultWorkflow" value="Simple Workflow"/>
-->      
      <property name="defaultWorkflow" value="Standard Workflow"/>
      <property name="templates">
      		<pvalues>
      		    <pvalue>rffSnCallout</pvalue>
      		    <pvalue>rffSnTitleLink</pvalue>  		    
      		</pvalues>
      </property>
      <property name="workflows">
      		<pvalues>
<!--      
      		    <pvalue>Simple Workflow</pvalue>
-->      
      		    <pvalue>Standard Workflow</pvalue>
      		</pvalues>
      </property>


      <property name="fields"> 
         <propertySet name="webdavowner">
               <property name="sequence" value="1"/>
               <property name="default"  value="helloOwner"/>
         </propertySet>

         <propertySet name="img2_filename"/>

<!--
         <propertySet name="placeholder">
		      <property name="default"  value="hello"/>
		      <property name="required"  value="true"/>
		      <property name="sequence" value="0"/>
		      <property name="showInPreview" value="false"/>
		      <property name="userSearchable" value="true"/>
         </propertySet>
-->         
      </property>
      
      <property name="fields_null_value1"/>

      <property name="fields_null_value2">
      </property>
      
      
	</propertySet>
	
	<propertySet name="fd">
      <property name="default"  value="hello"/>
      <property name="required"  value="true"/>
      <property name="sequence" value="0"/>
      <property name="showInPreview" value="false"/>
      <property name="userSearchable" value="true"/>
	</propertySet>
	
	<propertySet name="callout">
      <property name="label"  value="Call Out"/>
<!--       
      <propertySet name="controlParameters">
	      <property name="height" value="100"/>
	      <property name="width" value="40"/>
      </propertySet>
-->
      <property name="controlParameters">
	      <pvalues>
	      	<pair value1="height" value2="100" />
	      	<pair value1="width" value2="40" />
	      </pvalues>
	   </property>
	</propertySet>
	
   </SolutionConfig>
</SolutionConfigurations>
